<?xml version="1.0" encoding="UTF-8" ?>
<Students xmlns="http://artiuschik.it-academy.by/xml/students"
          xmlns:xsi="http://www.w3.org/2001/XMLSchema-instance"
          xsi:schemaLocation="http://artiuschik.it-academy.by/xml/students  TestingXSD.xsd"
>
    <Student id="123">
        <Name>Ivanov</Name>
        <Surname>Ivan</Surname>
        <Course>2</Course>
        <Tests>
            <Test subject="Algebra">
                <question complexity="hard">Question №1</question>
                <question complexity="easy">Question №2</question>
                <question complexity="medium">Question№3</question>
            </Test>
            <Test subject="Geometry">
                <question complexity="hard">Question №1</question>
                <question complexity="easy">Question №2</question>
                <question complexity="hard">Question№3</question>
            </Test>
            <Test subject="English">
                <question complexity="medium">Question №1</question>
                <question complexity="hard">Question №2</question>
                <question complexity="hard">Question№3</question>
            </Test>
        </Tests>
        <Results>
            <result subject="Math">9</result>
            <result subject="Geometry">8</result>
            <result subject="English">9</result>
        </Results>
    </Student>
</Students>